{
  "type": "account-ecosystem",
  "id": "2aac7cec-0b1d-ac42-a369-610223b786a4",
  "creationDate": "2019-03-13T10:41:04.858Z",
  "version": 4,
  "application": {
    "architecture": "x86-64",
    "buildId": "20190227201333",
    "name": "Firefox",
    "version": "67.0a1",
    "displayVersion": "67.0a1",
    "vendor": "Mozilla",
    "platformVersion": "67.0a1",
    "xpcomAbi": "x86_64-gcc3",
    "channel": "default"
  },
  "payload": {
    "ecosystemClientId": "5bdc7cec-0b1d-ac42-a369-610223b7869d",
    "ecosystemUserId": "abcdefghabcdefghabcdefghabcdefghabcdefghabcdefghabcdefghabcdefgh",
    "previousEcosystemUserIds": ["18cdefghabcdefghabcdefghabcdefgh1bcdefghabcdefghabcdefghabcdefg3"],
    "duration": 8547,
    "scalars": {
      "parent": {
        "browser.engagement.active_ticks": 12,
        "browser.engagement.total_uri_count": 3
      }
    },
    "keyedScalars": {
      "key1": 12,
      "key2": "foo"
    },
    "histograms": {
      "content": {},
      "dynamic": {},
      "extension": {},
      "gpu": {},
      "parent": {},
      "socket": {}
    },
    "keyedHistograms": {
      "content": {},
      "dynamic": {},
      "extension": {},
      "gpu": {},
      "parent": {
        "SEARCH_COUNTS": {
          "google.in-content:sap:firefox-b-d": {
            "bucket_count": 3,
            "histogram_type": 4,
            "sum": 1,
            "range": [
              1,
              2
            ],
            "values": {
              "0": 1,
              "1": 0
            }
          },
          "google-b-d.urlbar": {
            "bucket_count": 3,
            "histogram_type": 4,
            "sum": 1,
            "range": [
              1,
              2
            ],
            "values": {
              "0": 1,
              "1": 0
            }
          }
        }
      },
      "socket": {}
    }
  }
}
